"Identificador URL";Nome;Categorias;"Nome da variação 1";"Valor da variação 1";"Nome da variação 2";"Valor da variação 2";"Nome da variação 3";"Valor da variação 3";Preço;"Preço promocional";"Peso (kg)";"Altura (cm)";"Largura (cm)";"Comprimento (cm)";Estoque;SKU;"Código de barras";"Exibir na loja";"Frete gratis";Descrição;Tags;"Título para SEO";"Descrição para SEO";Marca;"Produto Físico";"MPN (Cód. Exclusivo Modelo Fabricante)";Sexo;"Faixa etária";Custo
dedeira-avalon-tec-one;"Dedeira Avalon Tec One";Dedeiras;;;;;;;189.00;170.10;0.1;5;8;3;12;DED-TEC-001;6426010922905;SIM;NÃO;"Dedeira profissional Avalon Tec One para arco recurvo. Ideal para arqueiros intermediários e avançados.";"arco,flecha,dedeira,recurvo,avalon";"Dedeira Avalon Tec One | 720x Arco e Flecha";"Compre a Dedeira Avalon Tec One na 720x. Proteção e conforto para suas flechadas.";Avalon;SIM;;Unissex;;85.00
flechas-avalon-hybrid;"Flechas Avalon Hybrid";"Flechas montadas";;;;;;;48.00;43.20;0.05;2;1;80;45;FLE-AVL-002;7891234567001;SIM;NÃO;"Flechas Avalon Hybrid de alta durabilidade. Perfeitas para treino e competição.";"flecha,avalon,hybrid,treino";"Flechas Avalon Hybrid | 720x Arco e Flecha";"Flechas Avalon Hybrid - Durabilidade e precisão. Unidade.";Avalon;SIM;;Unissex;;25.00
bortonock-720x;"BortoNock - 720x";Nocks;;;;;;;47.00;42.30;0.01;1;1;2;120;NOC-720-003;7891234567002;SIM;NÃO;"Nock exclusivo 720x. Encaixe perfeito e durabilidade superior. Pacote com 12 unidades.";"nock,720x,flecha,acessorio";"BortoNock 720x | Nock Premium";"BortoNock 720x - Nocks de alta qualidade para suas flechas.";720x;SIM;;Unissex;;20.00
kit-pro-dragon-x8-preto-sanlida;"Kit Pro Dragon X8 (Preto) - Sanlida";"Dragon 8";;;;;;;3150.00;2835.00;3.5;20;60;80;3;KIT-DRG-004;7891234567003;SIM;NÃO;"Kit completo Pro Dragon X8 Sanlida (Preto). Arco composto profissional com acessórios. Ideal para competidores.";"arco composto,dragon,sanlida,kit,profissional";"Kit Pro Dragon X8 Sanlida | Arco Composto";"Kit completo Pro Dragon X8 - Arco composto profissional Sanlida.";Sanlida;SIM;;Unissex;;1500.00
arco-recurvo-escola-magnesio-jandao;"Arco Recurvo Escola (Magnésio) - Jandao";Kits;;;;;;;1010.00;909.00;1.5;15;50;70;8;ARC-ESC-005;7891234567004;SIM;NÃO;"Arco Recurvo Escola com riser em magnésio Jandao. Perfeito para iniciantes e clubes de arqueria.";"arco recurvo,jandao,iniciante,escola,kit";"Arco Recurvo Escola Jandao | Kit Iniciante";"Arco Recurvo Escola Jandao - Kit completo para iniciantes.";Jandao;SIM;;Unissex;;450.00
outdoor-composto-alvo-oficial-wa-80cm;"OUTDOOR COMPOSTO - Alvo oficial WA 80cm (10 unidades)";Alvos;;;;;;;89.00;80.10;0.5;80;80;2;25;ALV-OUT-006;7891234567005;SIM;NÃO;"Alvo oficial WA 80cm para tiro de campo (outdoor composto). Pacote com 10 unidades.";"alvo,outdoor,wa,competicao,composto";"Alvo Oficial WA 80cm | 10 Unidades";"Alvo oficial WA 80cm para outdoor composto. Pacote com 10.";Avalon;SIM;;Unissex;;40.00
